{
  "$schema": "./schemas/persona-authorship-manifest.schema.json",
  "authored_header": [
    "variant_id",
    "batch_id",
    "category",
    "category_group",
    "topic_id",
    "editorial_role",
    "semantic_group",
    "output_mode",
    "trigger",
    "required_context",
    "tone",
    "interrupt_cost",
    "cooldown_hours",
    "semantic_cooldown_hours",
    "max_per_day",
    "weight",
    "relationship_profile",
    "text",
    "review_status"
  ],
  "batch_count": 100,
  "batches": {
    "b001": {
      "metadata_sha256": "71679e804a80b70aabef7a9d6fb8f47050429df14269c008386dd22a6147fb51",
      "row_count": 300,
      "text_sha256": "7abb24a9701703775c2e4009ba615f48056802e5a4dfa42085e52a80d1c51acc"
    },
    "b002": {
      "metadata_sha256": "55de90ad240c286e20dedff87ddd2ae12a79e1781e6f23748c286b3b41714d05",
      "row_count": 300,
      "text_sha256": "0ec3b7b50baac8c66b05c78d934699f88d0c56cecfedba8ffadce42c5e630214"
    },
    "b003": {
      "metadata_sha256": "57d35886155f64a8026116009288e3fc6c590a8a8b05ea902cf606a8c72cf575",
      "row_count": 300,
      "text_sha256": "f4b4c012ccf27f2eb013a256e1e7dfc3b1c2eaaf9e526d941dcc0e3100df9544"
    },
    "b004": {
      "metadata_sha256": "dc0b1302e41f1144aba6598771029aed29c3ed02759596c3b04c858f600d1829",
      "row_count": 300,
      "text_sha256": "f679431e89ceb93b554ca498277c7837702ed1f45c0c52631422dfd97f912572"
    },
    "b005": {
      "metadata_sha256": "8d5d7646458a0f37f0f47a285bccd5337883642b5cbdbafbbf8c3f5a1ba2a55e",
      "row_count": 300,
      "text_sha256": "25c41e020ba15861d82ed4bb13b334628fcb7eabaa8c239aa62eeadfd35c5967"
    },
    "b006": {
      "metadata_sha256": "21d541539a65a7a3c159dc1ad894e3307ae6a286612692e482dce648a75e8f22",
      "row_count": 300,
      "text_sha256": "2dce0782c2f8b4eeb0912516a97f877c34cd475e6cc645fe551a0a82e139f778"
    },
    "b007": {
      "metadata_sha256": "73a0bc1ea68419f8904e2365fc4a8677b2c262eb7a94e7fe52a13541045d1be5",
      "row_count": 300,
      "text_sha256": "4ae46d15c3a352e7b9b9599f3cbdfdd816cdb44c78bfed23a4af6d58cb845844"
    },
    "b008": {
      "metadata_sha256": "85440aa6e00d5ffa9282e9d774b6995f4520ada2fb19ec1e51e2b8e574bc3fcc",
      "row_count": 300,
      "text_sha256": "b8395403b459f46c9ba35d4a19c33e82cb0f273598be13afef4a53a77ef7986d"
    },
    "b009": {
      "metadata_sha256": "e4cd32e62e12576d7f37b695173b80ab4d8527211a0f970370bfdd0c3d352920",
      "row_count": 300,
      "text_sha256": "6c7846fa7cdd0bee2dc2389229b4796f4a013c3156ee92c37b72ca7eecfd39cc"
    },
    "b010": {
      "metadata_sha256": "a05d731b8d0e263dc1d7b9c80c2ff3d13d0dbd9842877fc78dc59a2601670204",
      "row_count": 300,
      "text_sha256": "1e8de032bbf58f143fd3cfe74a03db65e1995ca421f34ca69bebaa47e1d5d130"
    },
    "b011": {
      "metadata_sha256": "01246ca4e17a4ea7556e61ddef7fa81c56c1fe10d947ed14ed0fa910f484204e",
      "row_count": 300,
      "text_sha256": "eec20de7c30743fb220a0e3e85e0f0ddce48a8ba85deadff73c6038bd2e50040"
    },
    "b012": {
      "metadata_sha256": "1bc32585e990ac31631dae8423396d3e3ff6497ab87dfda66067b26689350138",
      "row_count": 300,
      "text_sha256": "61dc81e1ced496282bf95400139c9f252a057925a051eeab918d02e9e978668c"
    },
    "b013": {
      "metadata_sha256": "f850aa2de264eaa33942bcb730898fa649590bd96c7d4292415321565b31950a",
      "row_count": 300,
      "text_sha256": "b0b3ed23b3d582550d792c8b6101024db2959bccdc499d6ebf9151eec52b7f0c"
    },
    "b014": {
      "metadata_sha256": "6d5ae59c75cc9446883406752511d7d96332000198f371133a6b09734c1feeac",
      "row_count": 300,
      "text_sha256": "2baac0ef4357cb4700a90612122f04d6ef39aa9daf337454a0969e8085b7746a"
    },
    "b015": {
      "metadata_sha256": "8be45689412e43a6a0797656d7d7de3f23cfbf3b94b4b4acd8c2273baf07f9d5",
      "row_count": 300,
      "text_sha256": "62dd84961e739b6933045dab34636eed5cbb27f62989a408f2c29f68f2eb5f53"
    },
    "b016": {
      "metadata_sha256": "adba2ee0adbe6191680da5dbca5ca2b83e7ede01f286e189e775246f03da659d",
      "row_count": 300,
      "text_sha256": "ab208eb2bb7a861914e81360222cccd9a5668751e5d890cb830133b79908500c"
    },
    "b017": {
      "metadata_sha256": "bce358cc9416ef0cc3d0594e107a16869ac8649b072d164bd4ec30e232587799",
      "row_count": 300,
      "text_sha256": "2e35713f66f4643c9eaae0437b87127b7f5f79d4416a00344a882deae25b49e6"
    },
    "b018": {
      "metadata_sha256": "e17aa56ec7b07b2bdf086546fcd1cae9b7db2be3c6933de7dcb97e63eecda993",
      "row_count": 300,
      "text_sha256": "fb32f7a5b99d5c85977ae800c2c4c1dc9f209ecfc796750e9bbc13d71aec6035"
    },
    "b019": {
      "metadata_sha256": "5d4fedd72c490ac3ff1e2547f1ae8f8200229bd051573cc1484701eca137fffc",
      "row_count": 300,
      "text_sha256": "60ed415869c7b10cccf4dd11f6c136124da5417937d260ea9e915ed33f20f009"
    },
    "b020": {
      "metadata_sha256": "56889f123040554b172a66c15e4454a3c558f36a54b774b0a4d7f9ce2bf9dfab",
      "row_count": 300,
      "text_sha256": "d10ad708acf55b2e7d7afcadfa3c09c8652840cc48f9a69106b27d8197fea75e"
    },
    "b021": {
      "metadata_sha256": "47704163c08b85f41a6d02dabbda02c7144aa5b53454545d46d45122a5b444b8",
      "row_count": 300,
      "text_sha256": "15ac636599a49bee78f156aab3011f9a15cf4ddef21c05b59e20afd68f864556"
    },
    "b022": {
      "metadata_sha256": "7629e23a72f7a943908a72307fd34aff116fcd63f737c5e81197614912ec07ac",
      "row_count": 300,
      "text_sha256": "c60479ce9a3fa06bb2b785359476ad77a4c1e416438f2b0c901249e8a64e8c1f"
    },
    "b023": {
      "metadata_sha256": "f010caf9c6e2245bcd03351b880834ba602189eb2cb2d958058a35da66d386ff",
      "row_count": 300,
      "text_sha256": "568f474919fb231aab2b64f620a502942051d4554fea8773b641288ad461bf81"
    },
    "b024": {
      "metadata_sha256": "33a1f60af98e38045af5050e0f80c1ed0a2c60110ec03bbefd12e9b686961bd0",
      "row_count": 300,
      "text_sha256": "273770fccb10b3f7e6148ddb33e5a14fbc17c7887aba2edb432202190a128096"
    },
    "b025": {
      "metadata_sha256": "e6750e23b9dfaefb49c3d3e99d838ae6e34590ac2cf0b13335a301f0b67f2a96",
      "row_count": 300,
      "text_sha256": "1d47f4728626033b9afc3a3fda79c5d68629e8b914d8fba1bc0c385a1426cc72"
    },
    "b026": {
      "metadata_sha256": "f530cca33b3f63fdcf7f42f57f739dbb7914c9877a1a143b19de45f427bfa3ca",
      "row_count": 300,
      "text_sha256": "c22ac38ca7d720f96ba44cccd81f589be1bac1f32d8a0f539061145c6a16e305"
    },
    "b027": {
      "metadata_sha256": "63846b0a1727b7de27b6c5d099da2f8e62381c0a0c4f79d94668488f6ed61d44",
      "row_count": 300,
      "text_sha256": "1545c2df526284d4079f76e08a2ac1ab350e2c47d8627931ac49432058e19c6c"
    },
    "b028": {
      "metadata_sha256": "8b9e096478ae499e7dabae37202c595b154d6a528d27c0392b7a96f684f52efd",
      "row_count": 300,
      "text_sha256": "6a4a20328d71ee387f1bc9bb4f013a0f19472c82f75d24acfa2d9f3eb41652f6"
    },
    "b029": {
      "metadata_sha256": "0e441f1e8d431356b2320b10e9c09fefd341e1f080d70e7fa8cce266d60be2e3",
      "row_count": 300,
      "text_sha256": "93a8ccb85be6cb96749abe0b799e2d664fd50c463f50dae85e72a91f3311596a"
    },
    "b030": {
      "metadata_sha256": "63a4fd6e33676b832ac4dcf5eb189326bb4fc088dfdbdf986ec7416ba35c5259",
      "row_count": 300,
      "text_sha256": "8678ebc437ae35221aa922fec3088f31c91ef4eface87348d1aaaa74fcdbfccd"
    },
    "b031": {
      "metadata_sha256": "88bbce33a9964b6d21c332cf881420fe65fa11a7816c155ee3c1e67f74df8ca5",
      "row_count": 300,
      "text_sha256": "667815489b7af0537a1995bcd7c940591d1bbe7bd36a1441b366a73a9933a6ce"
    },
    "b032": {
      "metadata_sha256": "c8ad8d30e2c258bf275145128fb851ccd84a61629f6f2aa9fdb72a66ba60fe78",
      "row_count": 300,
      "text_sha256": "9cc6ab8004d7eda9c8285d07996485597ed9ee5ac81856d4e656548bb641d9bc"
    },
    "b033": {
      "metadata_sha256": "6450caf45b7ad46bd584ce2e28f6e976fd3d0a8d358a501ea8daadd910389aff",
      "row_count": 300,
      "text_sha256": "b4736ddba0bd29ad04b6b01fc1f0afa8c997365bd2e03327e0dccf42e35cd6e9"
    },
    "b034": {
      "metadata_sha256": "61c39b5fc2f329391f026f85196ef97eae6c2f34a2656d0831b35773c6e4bf1d",
      "row_count": 300,
      "text_sha256": "135c2581972b9b1610fdad99748bece6194a74fd5a4701217ff73f9cb6535cb2"
    },
    "b035": {
      "metadata_sha256": "dd26a31da92d0cad1ae5517640a82e154a02d5e2b0774b3a29c695da97030778",
      "row_count": 300,
      "text_sha256": "d67f949c27c7223cb595a73d7b7b4f1b40153d34c1ffdda7e47a1fcb71c7b0f9"
    },
    "b036": {
      "metadata_sha256": "f6491c38ad9f1a950fc961d03c52580f1d11d68b45c038326046f0b251bf2bcc",
      "row_count": 300,
      "text_sha256": "746f90c769959fb8287f61a18ef7ddfe3c9a7f61a3361ea696e855c827b16598"
    },
    "b037": {
      "metadata_sha256": "c702cfc03cafad1f8985bf11d016e220f0eb5c531d750e8034a72a50b5c14bb7",
      "row_count": 300,
      "text_sha256": "c60c806d9102d5d154ecaed9f6aa921d46e6515b332ae6d3d94e2db96cd96954"
    },
    "b038": {
      "metadata_sha256": "21ede54f245250d974dd2dc440761fe918fd4d5cd2e2f332380d24439567f7c3",
      "row_count": 300,
      "text_sha256": "645972a9128353e6827398cc2464a7e652940a696e094a279dca72b2f889d99b"
    },
    "b039": {
      "metadata_sha256": "0d6464eef76e6a387e2dd8df4bb3ef8961489bb381647d302167d603c3c837ee",
      "row_count": 300,
      "text_sha256": "474e24a1781fa32c5eb6189a4ee53caafa8519e9b0d5cc7332c3038ddad6718b"
    },
    "b040": {
      "metadata_sha256": "73f8e70c15f5deb8b6ceedd9647b7a6130222a9c804770260ba4c082a0995bf8",
      "row_count": 300,
      "text_sha256": "e2fcd976e6e6ee46335be823c81233d56a9c766c602f472069f9910df2b13f2a"
    },
    "b041": {
      "metadata_sha256": "488905169cdf708c60f2261c71c4c39cc7452f7d13f53f9056ef99f2015a3ce6",
      "row_count": 300,
      "text_sha256": "e4140c375592e5d858f7a41e0792b668527a50660d02a093076c14f78e7659e9"
    },
    "b042": {
      "metadata_sha256": "ce8f648c8467d5d10b839d3a42864596465b579eb0875bba9af2d9e36c643d4e",
      "row_count": 300,
      "text_sha256": "bc353e9d3b4fb02acc1d0d56ab7e10ade21bb40bb3436a5da9ffae5720070e09"
    },